{"$schema":"https://json-schema.org/draft/2020-12/schema","title":"Yalken R2.4 StageAdmission V2","type":"object","additionalProperties":false,"required":["schemaVersion","attestationType","status","decision","stageId","authorityId","authorityDigest","ownerAuthorityBindingDigest","sourcePlanDigest","stageInstanceDigest","writeSetDigest","commandScopeDigest","acceptanceSignalsDigest","verifierDigest","exactIdentity","lease","observedAtUtc"],"properties":{"schemaVersion":{"const":"STAGE_ADMISSION_ATTESTATION_V2"},"attestationType":{"const":"INDEPENDENT_PINNED_STAGE_ADMISSION"},"status":{"const":"ADMITTED"},"decision":{"const":"INSTANCE_IS_EXACT_SUBSET_OF_OWNER_AUTHORIZED_SUCCESSOR"},"stageId":{"type":"string"},"authorityId":{"type":"string"},"authorityDigest":{"$ref":"#/$defs/digest"},"ownerAuthorityBindingDigest":{"$ref":"#/$defs/digest"},"sourcePlanDigest":{"$ref":"#/$defs/digest"},"stageInstanceDigest":{"$ref":"#/$defs/digest"},"writeSetDigest":{"$ref":"#/$defs/digest"},"commandScopeDigest":{"$ref":"#/$defs/digest"},"acceptanceSignalsDigest":{"$ref":"#/$defs/digest"},"verifierDigest":{"$ref":"#/$defs/digest"},"exactIdentity":{"type":"object","additionalProperties":false,"required":["baseSha","headSha","treeSha","branch","targetRemote"],"properties":{"baseSha":{"$ref":"#/$defs/sha"},"headSha":{"$ref":"#/$defs/sha"},"treeSha":{"$ref":"#/$defs/sha"},"branch":{"type":"string"},"targetRemote":{"const":"origin"}}},"lease":{"type":"object","additionalProperties":false,"required":["fencingCounter","status","wip","predecessorReleaseDigest"],"properties":{"fencingCounter":{"type":"integer"},"status":{"const":"ACTIVE"},"wip":{"const":1},"predecessorReleaseDigest":{"$ref":"#/$defs/digest"}}},"observedAtUtc":{"type":"string","format":"date-time"}},"$defs":{"digest":{"type":"string","pattern":"^[0-9a-f]{64}$"},"sha":{"type":"string","pattern":"^[0-9a-f]{40}$"}}}
